{
  "schemaVersion": 1,
  "id": "agent-guidance",
  "purpose": "Maintain agent guidance within captured architectural authority",
  "responsibilities": [
    "Review instructions and skills together for clarity and consistency",
    "Validate tracked metadata before handoff",
    "Request validator changes from guidance-validation rather than editing its implementation",
    "Treat guidance edits as proposals for future runs, never current authority"
  ],
  "activities": [
    "research",
    "documentation",
    "testing",
    "implementation",
    "review",
    "release"
  ]
}
